Address, Latitude, Longitude
"Abed Dhali Road, Lake Circus, Kolabagan, Dhaka,Dhaka",23.7496622,90.3801731
"Central Road, Dhanmondi, Dhaka,Dhaka",23.7414697,90.38372009999999
"Elephant Road, New Market, Dhanmondi, Dhaka,Dhaka",23.7389658,90.38472
"Free School Street, Hatirpool, Dhanmondi, Dhaka,Dhaka",23.7444513,90.39033309999999
"Greenroad,Dhanmondi, Dhaka,Dhaka",23.7440923,90.3845501
"Kathal Bagan, Dhanmondi, Dhaka,Dhaka",23.7464364,90.38778479999999
"Lake Circus, Kalabagan, Dhaka,Dhaka",23.751615,90.3801692
"Maneshar Road, Jhigatola, Dhanmondi, Dhaka,Dhaka",28.3515381,76.9427774
"Niribili Housing, Shangkar, West Dhanmondi, Dhaka,Dhaka",23.74919,90.36508409999999
"North Circular  Road, Dhanmandi, Dhaka,Dhaka",23.7441994,90.38939429999999
"Post Office Goli, Jhigatola, Dhanmondi, Dhaka,Dhaka",23.7407124,90.3707046
"Road - 11A, Dhanmondi, Dhaka,Dhaka",23.7479994,90.37300189999999
"Road- 01, Block, B, West Dhanmondi Housing, Mohammadpur, Dhaka,Dhaka",23.7568838,90.3675937
"Road 01, Dhanmandi, Dhaka,Dhaka",23.7743325,90.41498539999999
"Road- 04, Shiddirganj, Narayanganj,Dhaka,Dhaka",23.7762137,90.41418709999999
"Road- 05, Dhandmondi, Dhaka,Dhaka",23.8569883,90.4027704
"Road- 05, Mitali Road, Dhanmondi, Dhaka,Dhaka",23.7419112,90.3688265
"Road 08, Abahoni Playground, Dhanmandi, Dhaka,Dhaka",23.7781535,90.41479009999999
"Road 10, Dhanmondi, Dhaka,Dhaka",23.7463721,90.3782796
"Road 10/A, Dhanmondi, Dhaka,Dhaka",23.7471301,90.3735799
"Road- 10A, Dhanmandi, Dhaka,Dhaka",23.7471301,90.3735799
"Road- 118, Crescent Road, Dhanmondi, Dhaka,Dhaka",23.7464358,90.3864121
"Road 13, Dhanmondi, Dhaka,Dhaka",23.7532533,90.3754901
"Road 14, Dhanmandi, Dhaka,Dhaka",23.754336,90.3752652
"Road 15, Pathshala goli, Dhanmondi, Dhaka,Dhaka",23.7545892,90.3742495
"Road- 19, Modhu Bazar, Dhanmond, Dhaka,Dhaka",23.7462049,90.3683731
"Road- 2A, Bosila Road, West Katasur, Mohammadpur, Dhaka,Dhaka",23.7528132,90.36228709999999
"Road- 4A, Dhanmondi, Dhaka,Dhaka",23.7413127,90.376038
"Road- 6A, Dhanmondi, Dhaka,Dhaka",23.7435347,90.3758933
"Road- 8A, Dhanmondi, Dhaka,Dhaka",23.7461495,90.3742307
"Road- 8A, East Rayerbazar, Dhanmondi, Dhaka,Dhaka",23.7493965,90.3651446
"Road- 9A, Dhanmondi, Dhaka,Dhaka",23.7461958,90.37416979999999
"Road, 4A, Hazaribah,Jhigatola, West Dhanmondi, Dhaka,Dhaka",23.7410326,90.3754048
"Road, 9A, Sangkar, Dhanmondi, Dhaka,Dhaka",23.7461958,90.37416979999999
"Road-10,Dhanmondi, Dhaka,Dhaka",23.7463721,90.3782796
"Road-12A, West Dhanmondi, Dhaka,Dhaka",23.7488491,90.377873
"Tallabagh, Sobhanbag, Dhaka,Dhaka",23.7553952,90.3765088
"West Razabazar, Dhanmondi, Dhaka,Dhaka",23.7554883,90.3846435
"Road- 07, Dhaka Cantonment, Dhaka,Dhaka",23.8577935,90.4021018
"Road, 06, Banani,  Dhaka Cantonment, Dhaka,Dhaka",23.862288,90.4017186
"Sreejoni Sharak, Kafrul, Dhaka,Dhaka",23.7895638,90.39131719999999
"Uttar Kafrul, Soronika Mor, Dhaka, Dhaka Cantonment, Dhaka,Dhaka",23.7927847,90.3818701
"Chameli Goli, Shantinagar, Dhaka,Dhaka",23.7389429,90.41252949999999
"AGB Colony, Motijheel, Dhaka,Dhaka",23.7351894,90.42253360000001
"Road- 10, Block- G, Aftabnagar, Dhaka-1212,Dhaka",23.7785642,90.4148103
"Washa Road, Purba Bashabo, Sabujbag , Dhaka-1214.,Dhaka",23.7363533,90.43326259999999
" Bazar Road, Dokkhin Kutubkhali, Jatrabari, Dhaka,Dhaka",23.7023458,90.43677339999999
" Shohid Faruk Road, West Jatrabari, Jatrabari, Dhaka,Dhaka",23.7483789,90.4138179
"Road- 04, Shanir Akhra, Jatrabari, Dhaka,Dhaka",23.7762137,90.41418709999999
"China building goli, Azimpur, Dhaka,Dhaka",23.7266183,90.3845286
"Nazimuddin Road, Azimpur , Dhaka,Dhaka",23.7216644,90.3994463
"Al Amin Road, Konapara, Demra, Dhaka,Dhaka",23.7110356,90.4714501
"Road- 05,  DOHS, Mohakhali, Dhaka,Dhaka",23.8569883,90.4027704
"Road- 22, Nur Box Lane, Becharam Dewri, Chockbazar, Dhaka,Dhaka",23.7163782,90.3994803
"Road-1, Dakshin Gau, Sobujbag, Dhaka,Dhaka",23.8695044,90.39784639999999
"Road 4, Adabor, Mohammadpur, Dhaka,Dhaka",23.7747184,90.35332199999999
"Tajmohol Road, Mohammadpur, Dhaka,Dhaka",23.76505,90.3628962
"Road 11, Mirpur 10, Mirpur, Dhaka,Dhaka",23.806246,90.36765799999999
"CRP Road, Newmarket, Savar, Dhaka,Dhaka",23.8548527,90.2626295
"Topkhana road,Segun Bagicha, Shantinagar, Dhaka,Dhaka",23.7300827,90.41018199999999
"Habibullah road,Shahbagh,Dhaka,Dhaka",23.7937703,90.38519749999999
"Road- 2, Section -2, Block- F, mirpur 2, Mirpur, Dhaka,Dhaka",23.8052647,90.37634349999999
"Ring Road,Moddho Badda, Dhaka.,Dhaka",23.7805462,90.4266584
"Chan Mia Masjid Road, Baipail, Ashulia, Savar, Dhaka. ,Dhaka",23.9325782,90.2784385
"Staff Quarter Road, Demra, Dhaka,Dhaka",23.7493886,90.4615274
"Road -10, Tilpa para, khilgaon, Dhaka,Dhaka",23.7470735,90.4284263
"Road 2, Shyamoli, Dhaka,Dhaka",23.7748134,90.36633139999999
"Ramna Thana Road, Ramna, Dhaka,Dhaka",23.7330218,90.3983829
"Road- 9, Sector-9, Uttara, Dhaka,Dhaka",23.8705584,90.3988047
"Road- 53, Gulshan- 2, Dhaka,Dhaka",23.7954335,90.41215079999999
"Dilu Road, Mogbazar, Hatirjheel, Dhaka,Dhaka",23.7490786,90.4006103
"Road- 03, Nolvog Khalpar, Uttara, Dhaka.,Dhaka",23.8599216,90.4044243
"Road no.13, Section-6, Mirpur, Dhaka,Dhaka",23.8148354,90.3640917
"Shapla Housing, Morpol, Savar, Dhaka,Dhaka",23.8039919,90.2590263
"Lal Mia Street, Wari, Dhaka,Dhaka",23.7224825,90.41027609999999
"Distillery Road, Gendariya, Jatrabari, Dhaka,Dhaka",23.7058801,90.4229805
"Bottola road, Boardbazer Gazipur Sadar, Gazipur,Dhaka",23.9515664,90.3926123
"Bilaspur, Joydebpur, Gazipur,Dhaka",24.0041455,90.4158846
"khalatot molla road, Auch para, Tongi, Gazipur,Dhaka",23.9136816,90.39319789999999
"S.S. Academy Roads, Tongi, Gazipur,Dhaka",23.9096418,90.39623340000001
"Sahajalal Road, Boro Deura,Tongi, Gazipur,Dhaka",23.8513201,90.41289049999999
"Road- 12, Sector- 13, Uttara, Dhaka,Dhaka",23.8658116,90.3861682
"RK Mission Road, Gopibag, Dhaka,Dhaka",23.7219807,90.4262136
"Jakir Hossain Road, Block-E, Mohammadpur, Dhaka,Dhaka",23.7581143,90.3668727
"Road- 04, Block-C, Arifabad, Mirpur, Dhaka,Dhaka",23.7551752,90.37051830000001
"k block, Golden complex, Halishahar, Chattogram,Chattogram",22.3336206,91.7910132
"Road- 48, 1 no Dakesshori, Bondor, Narayanganj,Narayanganj",23.6237764,90.50004039999999
"Shasoaj road, Nitaigonj, Narayanganj,Narayanganj",23.6051413,90.5048158
"Kadamrasul road, 23 no ward, Narayanganj,Narayanganj",23.6302726,90.52200080000001
"Kadamrasul road, 23 no ward, Narayanganj,Narayanganj",23.6302726,90.52200080000001
"Road no- 01, Ram krishno road, Gopibag, Dhaka,Dhaka",23.7222615,90.42738299999999
"Sher e bangla ring road,Majdail,Narayanganj,Narayanganj",23.6250689,90.4911564
"Mizmizi Road, Poshchimpara, Siddhirganj, Narayanganj,Narayanganj",23.6821653,90.4950746
"Hazi brother's road, Jamtola, Narayanganj Sadar, Narayanganj,Narayanganj",23.6241465,90.493894
"TC Road, Jhalkori,  Siddhirganj, Narayanganj,Narayanganj",22.5046484,88.3377007
"Road no- 8, Housing area, Shiddirganj, Narayanganj,Narayanganj",23.6894656,90.484115
"Road-11, Cosmopolitan R/A, Chattogram City Corporation, Chattoggram,Chattogram",22.3624942,91.8221456
"MM Ali Road, Chakbazar, Chattogram City Corporation, Chattogram,Chattogram",22.3517735,91.8330525
"Road no- 3,West khulshi Residential Area, Chattogram City Corporation, Chattogram,Chattogram",22.3632534,91.8117307
"Road no- 3,West khulshi Residential Area, Chattogram City Corporation, Chattogram,Chattogram",22.3632534,91.8117307
